{
  "session_id": "session-curl-good",
  "timestamp_ms": 1234567895,
  "exercise": "right_arm_raise",
  "side": "right",
  "device_id": "test-packet",
  "sensor_status": "ok",
  "camera_status": "ok",
  "distance_cm": 48.5,
  "sensor_jitter_score": 0.12,
  "opencv_jitter_score": 0.15,
  "combined_jitter_score": 0.14,
  "jitter_detected": false,
  "shoulder_angle": 92.0,
  "elbow_angle": 166.0,
  "target_angle": 90.0,
  "landmark_confidence": 0.91,
  "rep_count": 3,
  "rep_phase": "holding",
  "hold_time_sec": 2.2,
  "pace": "good",
  "range_status": "target_met",
  "compensation": "none",
  "physio_score": 88,
  "coach_state": "good_form",
  "local_coach_message": "Great control. Keep that same pace.",
  "ai_coach_message": null,
  "avatar_status": "idle",
  "voice_status": "idle"
}
