{
  "session_id": "gemini-pipeline-001",
  "timestamp_ms": 1234567897,
  "exercise": "right_arm_raise",
  "side": "right",
  "device_id": "pipeline-test",
  "sensor_status": "ok",
  "camera_status": "ok",
  "distance_cm": 57.5,
  "sensor_jitter_score": 0.74,
  "opencv_jitter_score": 0.68,
  "combined_jitter_score": 0.71,
  "jitter_detected": true,
  "shoulder_angle": 61.0,
  "elbow_angle": 158.0,
  "target_angle": 90.0,
  "landmark_confidence": 0.86,
  "rep_count": 4,
  "rep_phase": "raising",
  "hold_time_sec": 0.0,
  "pace": "too_fast",
  "range_status": "too_low",
  "compensation": "shoulder_shrug",
  "physio_score": 52,
  "coach_state": "too_fast",
  "local_coach_message": "Slow down and control the movement.",
  "ai_coach_message": null,
  "avatar_status": "idle",
  "voice_status": "idle"
}
