{
  "session_id": "session-curl-fast",
  "timestamp_ms": 1234567896,
  "exercise": "right_arm_raise",
  "side": "right",
  "device_id": "test-packet",
  "sensor_status": "ok",
  "camera_status": "ok",
  "distance_cm": 51.0,
  "sensor_jitter_score": 0.2,
  "opencv_jitter_score": 0.22,
  "combined_jitter_score": 0.21,
  "jitter_detected": false,
  "shoulder_angle": 74.0,
  "elbow_angle": 164.0,
  "target_angle": 90.0,
  "landmark_confidence": 0.88,
  "rep_count": 2,
  "rep_phase": "raising",
  "hold_time_sec": 0.0,
  "pace": "too_fast",
  "range_status": "almost_there",
  "compensation": "none",
  "physio_score": 64,
  "coach_state": "too_fast",
  "local_coach_message": "Slow down and control the movement.",
  "ai_coach_message": null,
  "avatar_status": "idle",
  "voice_status": "idle"
}
